id,name,sector,stage,ticket_size_min,ticket_size_max,state,description,eligibility_summary,deadline,application_link,ministry
1,Startup India Seed Fund,All,Pre-Seed,5000,500000,All,Government of India fund to support innovative startups in the country,Must be incorporated as a private limited company; registered as a startup; less than 5 years old; not funded more than ₹10 lakh in any previous scheme,Ongoing,https://www.startupindia.gov.in/sif,Ministry of Commerce & Industry
2,DSIR Early Stage Innovation Fund,Deep Tech,Idea,200000,5000000,All,Department of Scientific and Industrial Research fund for early stage deep tech innovation,Can be individual researchers or teams; working on scientific/industrial research; not yet commercialized,Ongoing,https://www.dsir.gov.in,Ministry of Science & Technology
3,DPIIT Technology Fund,All,Pre-Seed,1000000,5000000,All,Department for Promotion of Industry and Internal Trade fund for technology-driven startups,Innovative technology startups; less than 7 years old; tech-focused business model,Quarterly,https://www.dpiit.gov.in,Ministry of Commerce & Industry
4,National Science Olympiad Grant,All,Idea,50000,500000,All,Support for young innovators participating in science competitions,Students/young researchers with innovative ideas; science/tech background,Ongoing,https://www.nao.nic.in,Ministry of Science & Technology
5,NASSCOM 10000 Startups,All,Seed,500000,2000000,All,Program to accelerate 10000 startups across India,Registered startup; working on innovative business model; based in India,Rolling,https://10000startups.nasscom.in,NASSCOM
6,SIDBI Stand Up India Loan Scheme,All,Pre-Seed,1000000,1000000,All,Low-interest loans from Small Industries Development Bank for startups,First generation entrepreneur; SC/ST category; woman entrepreneur; business plan ready,Ongoing,https://www.sidbi.in,Ministry of Micro Small Medium Enterprises
7,Pradhan Mantri MUDRA Yojana,All,Idea,50000,1000000,All,Collateral-free loans for small businesses and startups,Business plan ready; no existing loan; genuine business case,Ongoing,https://www.mudra.org.in,Ministry of Finance
8,National Startup Award,All,All,500000,5000000,All,Recognition and funding for startups solving critical challenges,Startups working on critical areas; less than 10 years old; Indian registered,Annual,https://www.startupindia.gov.in/awards,Ministry of Commerce & Industry
9,Invest India Venture Capital Fund,All,Seed,2000000,10000000,All,Government-backed VC fund for scaling startups,Series A+ stage; strong business fundamentals; Indian company,Rolling,https://www.investindia.gov.in,Ministry of Commerce & Industry
10,Karnataka Startup Policy Grant,All,Pre-Seed,500000,2000000,Karnataka,Karnataka government grant for startups registered in the state,Registered in Karnataka; less than 5 years old; tech/innovation focused,Rolling,https://www.startupkarnataka.in,Government of Karnataka
11,Maharashtra Innovation Scheme,All,All,1000000,5000000,Maharashtra,Support for innovative startups in Maharashtra,Registered in Maharashtra; innovative business model; job creation potential,Rolling,https://www.mahainnovation.gov.in,Government of Maharashtra
12,NASSCOM Technology Platform,All,Seed,1000000,3000000,All,Platform for SaaS startups to scale globally,SaaS business model; minimum ₹50 lakh revenue; export potential,Rolling,https://nasscom.in,NASSCOM
13,Biotechnology Ignition Grant,Biotech,Pre-Seed,500000,2000000,All,Support for biotech startups from Department of Biotechnology,Working on biotech/life sciences; registered company; research-backed,Ongoing,https://dbtindia.gov.in,Ministry of Science & Technology
14,Indian Angel Network Fund,All,Seed,1000000,5000000,All,Angel investment network supporting early stage startups,Innovative business model; strong founding team; scalable idea,Rolling,https://www.indianangelnetwork.com,Indian Angel Network
15,Agritech Accelerator Fund,Agritech,All,500000,2000000,All,Support for agricultural technology startups,Agritech business model; solving farmer problems; impact focus,Rolling,https://www.agriculturefund.in,Ministry of Agriculture
16,HealthTech Innovation Fund,HealthTech,Seed,1000000,5000000,All,Support for healthcare technology startups,HealthTech business model; regulatory compliance ready; impact potential,Rolling,https://www.healthtechfund.in,Ministry of Health
17,EdTech Acceleration Program,EdTech,Seed,500000,3000000,All,Support for educational technology startups,EdTech business model; proven user engagement; scalable content,Rolling,https://www.edfundingnetwork.in,Ministry of Education
18,Government e-Marketplace Grant,All,All,500000,5000000,All,Support for startups selling on GeM portal,Registered on GeM; B2B model; government procurement focus,Rolling,https://gem.gov.in,Department of Commerce
19,STPI Export Promotion Scheme,All,Pre-Seed,1000000,3000000,All,Support for IT/ITES startups with export potential,Export-focused IT startup; registered with STPI; minimum team of 3,Rolling,https://www.stpi.in,Ministry of Electronics & IT
20,Fintech Regulatory Sandbox,Fintech,Seed,2000000,10000000,All,RBI sandbox for fintech innovation and testing,Fintech business model; regulatory compliant; innovative solution,Rolling,https://www.rbi.org.in,Reserve Bank of India
21,Women Entrepreneurs Advancement Program,All,Pre-Seed,500000,2000000,All,Special grants and support for women-led startups,Woman founder/co-founder; innovative business model; registered company,Ongoing,https://www.womenentrepreneurs.gov.in,Ministry of Women & Child Development
22,Green Tech Innovation Fund,All,All,1000000,5000000,All,Support for environmentally sustainable technology startups,Green tech focus; environmental impact; sustainable business model,Rolling,https://www.greentechindia.gov.in,Ministry of Environment
23,Space Tech Startup Fund,All,Deep Tech,2000000,10000000,All,Support for space technology startups,Space tech focus; research-backed; commercial viability,Annual,https://www.isro.gov.in,Indian Space Research Organisation
24,Cybersecurity Innovation Fund,All,Seed,1000000,5000000,All,Support for cybersecurity startups,Cybersecurity focus; innovative solution; regulatory awareness,Rolling,https://www.cybersecurityfund.in,Ministry of Electronics & IT
25,AI and ML Innovation Fund,All,Seed,1000000,5000000,All,Support for AI/ML startups solving real problems,AI/ML technology core; problem-solution fit; market validation,Rolling,https://www.aimlstartupofindia.in,Ministry of Electronics & IT
26,ONDC Seller Support Program,All,Seed,500000,2000000,All,Support for sellers on Open Network for Digital Commerce,Registered on ONDC; retail/commerce focus; digital-first model,Rolling,https://ondc.org,Ministry of Commerce & Industry
27,Textile Tech Innovation Fund,All,All,500000,3000000,All,Support for technology startups in textile sector,Textile tech focus; industry problem solving; manufacturing link,Rolling,https://textiletechfund.in,Ministry of Textiles
28,Manufacturing Innovation Scheme,All,Seed,1000000,5000000,All,Support for startups in advanced manufacturing,Manufacturing focus; Industry 4.0 tech; Make in India alignment,Rolling,https://www.manufacturingfund.in,Ministry of Heavy Industries
29,Logistics Tech Acceleration Fund,All,Seed,500000,2000000,All,Support for logistics and supply chain tech startups,Logistics tech focus; supply chain optimization; scalable model,Rolling,https://www.logisticstech.in,Ministry of Road Transport
30,Renewable Energy Startup Fund,All,All,1000000,5000000,All,Support for renewable energy technology startups,Renewable energy focus; clean tech; commercial viability,Rolling,https://mnre.gov.in,Ministry of New & Renewable Energy
31,Water Tech Innovation Fund,All,Seed,500000,2000000,All,Support for water technology and management startups,Water tech focus; environmental impact; scalable solution,Rolling,https://www.watertechinnovation.in,Ministry of Water Resources
32,Waste Management Tech Fund,All,Seed,500000,2000000,All,Support for waste management and circular economy startups,Waste management focus; circular economy; environmental benefit,Rolling,https://www.wastetechfund.in,Ministry of Environment
33,Smart City Startup Program,All,Seed,1000000,3000000,All,Support for startups contributing to smart city development,Smart city solution; scalability to multiple cities; government partnership ready,Rolling,https://smartcitiesindia.gov.in,Ministry of Housing & Urban Affairs
34,Tourism Tech Innovation Fund,All,Seed,500000,2000000,All,Support for tourism and hospitality technology startups,Tourism tech focus; improving visitor experience; scalable model,Rolling,https://www.tourismindia.gov.in/,Ministry of Tourism
35,Sports Tech Acceleration Program,All,Seed,500000,2000000,All,Support for sports technology and fitness startups,Sports tech focus; athlete or sports industry connection; scalable,Rolling,https://www.sportstechindia.in,Ministry of Youth Affairs & Sports
36,NASSCOM AI for Social Good Program,All,All,500000,2000000,All,Support for AI startups solving social challenges,AI technology; social impact focus; measurable outcomes,Annual,https://nasscom.in,NASSCOM
37,Microsoft Reactor Startup Program,All,Seed,500000,1000000,All,Support and mentorship for startups using Microsoft technologies,Tech startup; using Microsoft stack; scalable idea,Rolling,https://www.microsoft.com/reactor,Microsoft
38,Google for Startups Accelerator,All,Seed,1000000,5000000,All,Google's mentorship and funding program for startups,Innovative business model; growth potential; technology focus,Rolling,https://startup.google.com,Google
39,Amazon Accelerator India,All,Seed,1000000,3000000,All,Support for e-commerce and Amazon ecosystem startups,E-commerce or AWS-focused; marketplace seller potential; scalable,Rolling,https://www.amazonaccelerate.com,Amazon
40,ICICI Bank Startup Loan Program,All,Pre-Seed,500000,2000000,All,Special loans for registered startups from ICICI Bank,Registered startup; business plan ready; collateral-backed option,Ongoing,https://www.icicibank.com,ICICI Bank
41,Axis Bank Startup Financing,All,Pre-Seed,500000,2000000,All,Financing options for early stage startups from Axis Bank,Business plan; founder background check; growth potential,Ongoing,https://www.axisbank.com,Axis Bank
42,HDFC Bank Emerging Ventures,All,Seed,1000000,3000000,All,Support and financing for emerging ventures,Strong business fundamentals; experienced team; scalable model,Rolling,https://www.hdfcbank.com,HDFC Bank
43,YCombinator India Fellowship,All,Seed,500000,2000000,All,YCombinator's startup accelerator with focus on India-bound companies,Innovative idea; strong founding team; scalable vision,Rolling,https://www.ycombinator.com,YCombinator
44,500 Global Startup Fund,All,Seed,1000000,5000000,All,500 Global investment fund for high-growth startups,Innovative business; strong team; global expansion potential,Rolling,https://500.co,500 Global
45,Accel Partners India Fund,All,Seed,1000000,10000000,All,Accel's investment fund for Indian startups,Scalable business model; experienced team; market opportunity,Rolling,https://www.accel.com,Accel Partners
46,Lightspeed Venture Fund,All,Seed,2000000,10000000,All,Lightspeed's investment in Indian startups,Growth stage potential; experienced founders; scalable model,Rolling,https://www.lsvp.com,Lightspeed Venture Partners
47,Tiger Global Fund,All,All,2000000,50000000,All,Tiger Global's investment fund for Indian startups,Strong growth metrics; experienced team; clear unit economics,Rolling,https://www.tigerglobal.com,Tiger Global
48,Sequoia Capital India Fund,All,All,1000000,10000000,All,Sequoia Capital's investment in Indian startups,Innovative solution; experienced team; market leadership potential,Rolling,https://www.sequoia.com,Sequoia Capital
49,Blume Ventures Fund,All,Seed,500000,2000000,All,Blume Venture's early stage investment fund,Early stage company; strong team; innovative product,Rolling,https://www.blume.vc,Blume Ventures
50,Bessemer Venture Partners Fund,All,Seed,1000000,10000000,All,Bessemer's investment in high-potential Indian startups,Scalable market; experienced founders; product-market fit,Rolling,https://www.bvp.com,Bessemer Venture Partners
51,SISFS - Startup India Seed Fund Scheme,Multi-sector,Early Stage,5000000,50000000,Pan-India,"Central government flagship scheme providing seed funding for startups to support proof of concept, prototype development, product trials, market entry, and commercialization.",Indian startups recognized by DPIIT; incorporated less than 7 years ago; minimum team of 2 co-founders,Rolling,https://seedfund.startupindia.gov.in/,DPIIT
52,Fund of Funds Scheme,Multi-sector,Growth,5000000,250000000,Pan-India,"Government corpus of ₹10,000 crore contributed to AIFs registered with SEBI for funding startups across stages.",DPIIT recognized startups; valid incorporation and regulatory compliance.,Rolling,https://www.sidbivcf.in/,DPIIT
53,DSIR - Startup Scheme,Deeptech/R&D,Seed,1000000,10000000,Pan-India,"Department of Scientific and Industrial Research scheme supporting innovation and R&D in deeptech startups with focus on indigenous technology development.",Registered Indian startups with strong R&D component; PhD/MTech team preferred,Quarterly,https://dsir.gov.in/,DSIR
54,SERB - Start-up Research Award (SRA),Deeptech/R&D,Seed,500000,5000000,Pan-India,"Science and Engineering Research Board scheme for early-stage R&D-based startups working in fundamental research commercialization.",DPIIT recognized startups; strong academic/research background,Biannual,https://www.serb.gov.in/,DST
55,DBT Biotechnology Startup Support - BIRAC,Biotech/Life Sciences,Seed,2000000,15000000,Pan-India,"Biotechnology Industry Research Assistance Council scheme for biotech startups with Government of India backing for clinical and commercial development.",Biotech startup with DPIIT recognition; regulatory compliance,Rolling,https://www.birac.nic.in/,DBT
56,NITI Aayog - Atal Innovation Mission (AIM) Startup Support,Multi-sector,Ideation/Seed,500000,5000000,Pan-India,"Flagship startup ecosystem initiative with mentorship and funding support through Atal Incubation Centers across India.",Student/academic-led or working professional teams; innovative idea,Rolling,https://aim.gov.in/,NITI Aayog
57,MSME Udyam Anudaan,Small Business,Seed,100000,1000000,Pan-India,"Ministry of MSME scheme providing immediate grant support for registered MSME startups for first 3 years of operation.",MSMEs registered on Udyam; less than 3 years old; annual turnover <50 crores,Quarterly,https://udyamregistration.gov.in/,Ministry of MSME
58,AgriTech Innovation Fund - Ministry of Agriculture,Agritech,Seed/Early,2000000,20000000,Pan-India,"Central government scheme targeting agricultural technology startups for mechanization, crop management, and farmer-centric solutions.",Agritech startup; valid business registration,Rolling,https://www.pib.gov.in/,Ministry of Agriculture
59,EduTech Innovation Scheme - Ministry of Education,Edtech,Seed,1000000,10000000,Pan-India,"NEP 2020 aligned scheme supporting startups developing innovative educational technology solutions for Indian education system.",Edtech startup with focus on Indian curriculum/affordability,Rolling,https://www.education.gov.in/,Ministry of Education
60,HealthTech Scheme - Ministry of Health,Healthtech,Seed,1500000,12000000,Pan-India,"National Health Authority scheme for digital health and medical technology startups supporting telemedicine, diagnostics, and patient management.",Healthtech startup; healthcare professional partnership encouraged,Rolling,https://www.nha.gov.in/,Ministry of Health & Family Welfare
61,Fintech Regulatory Sandbox - SEBI,Fintech,Early Stage,2000000,50000000,Pan-India,"Securities and Exchange Board initiative providing regulatory sandbox environment for fintech startups to test innovation in securities market.",DPIIT recognized fintech startup; minimum 3 years operation preferred,Quarterly,https://www.sebi.gov.in/,SEBI
62,Green Energy Startup Support - MNRE,Cleantech,Seed,2000000,25000000,Pan-India,"Ministry of New and Renewable Energy scheme for solar, wind, battery, and clean energy technology startups.",Cleantech startup; technology innovation demonstrated,Rolling,https://mnre.gov.in/,MNRE
63,Maharashtra Startup Scheme,Multi-sector,Seed/Early,1000000,50000000,Maharashtra,"State government providing capital subsidy up to 30% for startups in recognized sectors; interest subsidy on loans.",DPIIT recognized startup or state startup-registered entity; Maharashtra registration,Rolling,https://industries.maharashtra.gov.in/,Maharashtra State Industries
64,Telangana T-Hub Accelerator Program,Multi-sector,Early Stage,5000000,100000000,Telangana,"State-backed accelerator with funding, mentorship, and market access for startups across all sectors; T-Hub is premier startup hub.",DPIIT recognized or state-registered startup; any sector,Rolling,https://t-hub.co/,Telangana State Government
65,Karnataka Startup Cell - Grant Scheme,Multi-sector,Seed,1000000,20000000,Karnataka,"State government providing non-dilutive grants and accelerator support through established startup ecosystem infrastructure.",Startup registered in Karnataka; innovative business model,Rolling,https://www.kstartup.in/,Karnataka State Government
66,Tamil Nadu Startup Fund,Multi-sector,Early/Growth,5000000,150000000,Tamil Nadu,"State flagship fund with ₹500 crore allocated for equity investment and grants for startups at various stages.",DPIIT recognized startup; registered in Tamil Nadu,Rolling,https://tnstartup.tn.gov.in/,Tamil Nadu State Government
67,Gujarat Startup Scheme,Multi-sector,Seed/Early,500000,30000000,Gujarat,"State government providing 50-75% capital subsidy on machinery and equipment purchase for recognized sector startups.",DPIIT recognized startup with Gujarat operations,Rolling,https://startupgujarat.org/,Gujarat State Industries
68,Uttar Pradesh Startup Action Plan,Multi-sector,Seed,1000000,25000000,Uttar Pradesh,"State scheme providing land at concessional rates, tax holidays, and capital subsidies for eligible startups.",DPIIT recognized startup; UP registration,Rolling,https://www.startupup.in/,UP Government
69,Punjab Technology Startup Fund,Multi-sector,Early Stage,2000000,50000000,Punjab,"State government fund supporting technology startups with investment and mentorship through state startup center.",Startup registered in Punjab; technology sector focus,Rolling,https://technextup.in/,Punjab State Government
70,Rajasthan Startup Policy,Multi-sector,Seed,500000,15000000,Rajasthan,"State scheme providing grants for skill development, incubation center support, and branding for startups.",DPIIT recognized or state registered startup,Rolling,https://www.startuprajasthan.org.in/,Rajasthan State Industries
71,Haryana Startup Scheme,Multi-sector,Seed/Early,1000000,30000000,Haryana,"State government providing seed grants and loan subsidies for startups in manufacturing and technology sectors.",DPIIT recognized startup with Haryana base,Rolling,https://haryana.startupindia.org/,Haryana State Government
72,Kerala Startup Mission,Multi-sector,Seed/Early,1000000,25000000,Kerala,"State-led initiative providing grants, mentorship, and equity-free funding for startups through incubators and accelerators.",Startup registered in Kerala; technology/innovation focus,Rolling,https://startupmission.kerala.gov.in/,Kerala State Government
73,West Bengal Startup Hub,Multi-sector,Early Stage,1000000,20000000,West Bengal,"State government scheme providing grants and accelerator support for tech and innovation-focused startups.",DPIIT recognized startup; WB registration,Rolling,https://westbengal.startupindia.org/,WB State Government
74,Assam Startup Initiative,Multi-sector,Seed,500000,10000000,Assam,"State scheme supporting early-stage startups through grants and incubation center access.",Startup registered in Assam; any sector,Rolling,https://assamstartup.org/,Assam State Government
75,ICICI Foundation - Venture Fund,Multi-sector,Early/Growth,5000000,200000000,Pan-India,"Corporate venture capital fund investing in social impact and technology startups across India with strategic support.",DPIIT recognized or proven track record; social impact focus preferred,Rolling,https://www.icicibank.com/ventures,ICICI Bank
76,HDFC Bank Startup Loans,Multi-sector,Early Stage,2000000,50000000,Pan-India,"Bank scheme providing working capital and expansion loans for DPIIT recognized startups with lower interest rates.",DPIIT recognized startup; 3+ months operating history,Rolling,https://www.hdfcbank.com/startups,HDFC Bank
77,HSBC Startup Banking Program,Fintech/Tech,Early/Growth,5000000,100000000,Pan-India,"Banking solutions and growth capital for technology and fintech startups with regulatory support and banking infrastructure.",DPIIT recognized tech/fintech startup; minimum 2 years operation,Rolling,https://www.hsbc.co.in/,HSBC Bank India
78,Axis Bank Startup Connect,Multi-sector,Early Stage,1000000,50000000,Pan-India,"Dedicated banking program for startups providing structured loans, working capital, and advisory services.",DPIIT recognized startup or proven business model,Rolling,https://www.axisbank.com/startups,Axis Bank
79,Yes Bank Growth Funding,Multi-sector,Growth,10000000,500000000,Pan-India,"Investment and debt funding solutions for scaling startups with industry expertise and mentorship support.",DPIIT recognized startup; established business operations,Rolling,https://www.yesbank.in/startups,Yes Bank
80,ICICI Prudential Venture Fund,Multi-sector,Growth,20000000,500000000,Pan-India,"Corporate venture investment fund focusing on fintech, healthtech, and enterprise software startups.",DPIIT recognized; proven market traction,Rolling,https://www.iciciprudential.com/ventures,ICICI Prudential
81,IIT Alumni Fund,Multi-sector,Early/Growth,5000000,100000000,Pan-India,"Alumni-backed venture fund from IIT institutions providing capital and mentorship to startup founders.",Founded by IIT alumni or strong IIT team presence; technology focus,Rolling,https://iitalibi.org/,IIT Alumni Association
82,Google for Startups - Google Cloud Credits,Tech/SaaS,Early,0,2000000,Pan-India,"Massive credits on Google Cloud Platform services (compute, storage, ML) for qualified early-stage startups.",Pre-Series A tech startup; >3 months old; innovative product,Rolling,https://cloud.google.com/startups,Google
83,Microsoft Startup Program,Tech/SaaS,Early/Growth,0,5000000,Pan-India,"Microsoft Azure cloud credits, technical support, and mentorship for early-stage startups and scale-ups.",DPIIT recognized startup; tech product focus,Rolling,https://www.microsoft.com/startup,Microsoft
84,AWS Activate Program,Tech/SaaS,Seed/Early,0,10000000,Pan-India,"Amazon Web Services credits for startups at launch and growth stages with technical support and training.",Any stage tech startup; innovative AWS-ready product,Rolling,https://aws.amazon.com/activate/,AWS
85,NASSCOM Startup Support Program,Tech/IT,Early/Growth,2000000,50000000,Pan-India,"Industry association providing market access, mentorship, and funding connections for IT and tech startups.",Tech/IT startup; NASSCOM membership optional,Rolling,https://www.nasscom.in/startups,NASSCOM
86,Qualcomm Innovation Fellowship,Deeptech,Early,500000,5000000,Pan-India,"Corporate fellowship supporting early-stage deeptech and IoT startups with funding and mentorship from industry experts.",Technology-focused startup; focused on wireless/mobile/IoT,Quarterly,https://www.qualcomm.com/innovation/fellowship,Qualcomm
87,KPMG Lighthouse Program,Multi-sector,Growth,10000000,100000000,Pan-India,"Advisory and advisory-led investment program for high-growth startups preparing for Series A and beyond.",DPIIT recognized startup; minimum Series A readiness,Rolling,https://kpmg.in/startups,KPMG
88,Accenture Venture Innovation Partnerships,Tech/Digital,Early/Growth,5000000,100000000,Pan-India,"Strategic partnerships and investments in digital transformation and emerging technology startups.",Digital/cloud/AI focused startup; proven technology traction,Rolling,https://www.accenture.com/ventures,Accenture
89,Deloitte Startup Connect,Multi-sector,Growth,10000000,150000000,Pan-India,"Advisory services and growth capital access for scaling startups through consulting support and partner network.",DPIIT recognized startup; ₹10-50 crore revenue range,Rolling,https://www2.deloitte.com/startups,Deloitte
90,EY Startup Program,Multi-sector,Early/Growth,5000000,100000000,Pan-India,"Mentorship, technology support, and market access for startups across all stages and sectors.",Registered startup with innovative business model,Rolling,https://www.ey.com/en_in/startups,Ernst & Young
91,AICTE Prime Grant Scheme,Edtech/Tech,Seed,500000,5000000,Pan-India,"All India Council for Technical Education supporting educational startups and student-led innovation ventures.",AICTE-recognized institution association or student founders; education/tech focus,Annual,https://www.aicte-india.org/,AICTE
92,MHRD Innovation Scheme,Edtech/Multi-sector,Seed,500000,10000000,Pan-India,"Ministry of Education (formerly MHRD) supporting innovation-based startups with institutional backing and grants.",Student or academic researcher founders; innovative project,Annual,https://www.education.gov.in/,Ministry of Education
93,INSPIRE Program - Department of Science,Deeptech/R&D,Seed,1000000,10000000,Pan-India,"Innovation in Science Pursuit for Inspired Research program supporting high-risk science and technology ventures.",PhD-holder or strong research background; fundamental science focus,Rolling,https://www.inspireawards.gov.in/,DST
