id,name,sector,stage,ticket_size_min,ticket_size_max,state,description,eligibility_summary,deadline,application_link,ministry
94,CSIR Technology Incubator Program,Deeptech,Early,2000000,20000000,Pan-India,"Council of Scientific and Industrial Research incubator supporting commercialization of lab innovations and deeptech.",CSIR lab collaboration; innovative deeptech product,Rolling,https://csir.res.in/,CSIR
95,ISRO Technology Transfer Program,Deeptech/Space,Early,2000000,25000000,Pan-India,"Indian Space Research Organisation supporting commercialization of space technology for satellite and space-related startups.",Space/satellite technology focus; ISRO collaboration,Rolling,https://www.isro.gov.in/,ISRO
96,Department of Atomic Energy Innovation Fund,Deeptech/Nuclear,Early,2000000,20000000,Pan-India,"Supporting startups developing nuclear technology applications and innovative atomic science ventures.",Nuclear science background; DAE collaboration,Rolling,https://www.aec.gov.in/,DAE
97,BARC Technology Incubator,Deeptech,Early,1500000,15000000,Pan-India,"Bhabha Atomic Research Centre supporting commercialization of BARC laboratory innovations and deeptech products.",BARC institutional collaboration; science/tech innovation,Rolling,https://www.barc.gov.in/,DAE
98,Indian Railways Startup Innovation Challenge,Mobility/Logistics,Early/Growth,5000000,50000000,Pan-India,"Ministry of Railways supporting startups innovating in railway technology, logistics, and passenger services.",Railway tech/mobility innovation; proven prototype,Rolling,https://www.indianrailways.gov.in/,Ministry of Railways
99,Serum Institute Vaccine Development Fund,Biotech/Healthcare,Early,5000000,50000000,Pan-India,"Support for biotech startups developing vaccines and pharmaceutical innovations with Serum Institute network access.",Biotech/pharma startup; vaccine development focus,Rolling,https://www.seruminstitute.com/,Serum Institute of India
100,Dr Reddy's Pharma Innovation Fund,Biotech/Healthcare,Early/Growth,5000000,100000000,Pan-India,"Investment and partnership opportunities for pharmaceutical and biotech startups in drug development and healthcare tech.",Pharma/biotech startup with innovative product or platform,Rolling,https://www.drreddys.com/,Dr Reddy's Laboratories
101,Infosys Startup Program,Tech/Digital,Early/Growth,5000000,100000000,Pan-India,"Technology investments and partnership opportunities for digital transformation and emerging tech startups.",Tech/digital innovation startup; Series A readiness preferred,Rolling,https://www.infosys.com/ventures,Infosys
102,Wipro Ventures Fund,Multi-sector,Growth,20000000,300000000,Pan-India,"Corporate venture capital investing in enterprise software, cloud, and digital technology startups.",Tech/SaaS startup; B2B focus; minimum ₹5 crore revenue,Rolling,https://www.wipro.com/ventures,Wipro
103,TCS Startup Program,Tech/IT,Early/Growth,5000000,150000000,Pan-India,"Tata Consultancy Services supporting IT startups with market access, investment, and technology infrastructure support.",DPIIT recognized IT/tech startup,Rolling,https://www.tcs.com/startups,TCS
104,L&T Innovation Venture Fund,Deeptech/Manufacturing,Growth,50000000,500000000,Pan-India,"Larsen & Toubro investment fund for manufacturing, IoT, AI and industrial technology startups.",Deeptech/manufacturing/IoT startup; Series A+; proven traction,Rolling,https://www.lntecc.com/,L&T
105,ABB Venture Fund,Industrial/IoT,Early/Growth,5000000,100000000,Pan-India,"ABB supporting industrial automation, IoT, and electrical technology startups for manufacturing transformation.",Industrial/IoT/automation startup; B2B technology focus,Rolling,https://www.abb.com/ventures,ABB
106,Hero Ventures Fund,Mobility/Tech,Early/Growth,5000000,200000000,Pan-India,"Hero Group supporting mobility, automotive, and IoT-based technology startups.",Mobility/auto-tech/IoT startup; proven prototype or initial traction,Rolling,https://www.heroventures.com/,Hero MotoCorp
107,Mahindra Ventures,Multi-sector,Early/Growth,5000000,150000000,Pan-India,"Mahindra Group corporate venture investing in agritech, mobility, and emerging technology startups.",Innovation in automotive/agri/enterprise tech,Rolling,https://www.mahindraventures.com/,Mahindra Group
108,Bajaj Auto Mobility Fund,Mobility/EV,Early/Growth,5000000,100000000,Pan-India,"Bajaj Auto supporting electric vehicle, two-wheeler tech, and mobility solutions startups.",Mobility/EV/two-wheeler tech startup; proven technology,Rolling,https://bajajventures.com/,Bajaj Auto
109,Reliance Jio Startup Accelerator,Tech/Digital,Early/Growth,5000000,100000000,Pan-India,"Reliance Industries supporting 5G, IoT, digital platform, and connectivity-based startups.",5G/IoT/digital platform startup; technology innovation focus,Rolling,https://jiostartups.reliance.com/,Reliance Industries
110,GAIL Innovation Fund,Cleantech/Energy,Early,5000000,50000000,Pan-India,"Gas Authority of India supporting startups in energy efficiency, gas technology, and clean energy solutions.",Energy/cleantech startup; utility/industrial focus,Rolling,https://www.gailindia.com/,GAIL
111,Coal India Technology Fund,Cleantech/Mining,Early,5000000,50000000,Pan-India,"Coal India Limited supporting startups in mining technology, renewable energy, and sustainable operations.",Mining/energy tech startup; deep tech innovation,Rolling,https://www.coalindia.in/,Coal India Limited
112,ONGC Venture Fund,Energy/Tech,Early/Growth,5000000,100000000,Pan-India,"Oil and Natural Gas Corporation supporting energy, deeptech, and innovative oil & gas technology startups.",Energy/oil-gas tech startup; B2B technology focus,Rolling,https://www.ongcindia.com/,ONGC
113,Hindustan Petroleum Startup Support,Cleantech/Energy,Early,5000000,50000000,Pan-India,"HPCL supporting clean energy, refining technology, and sustainable fuel alternatives startups.",Cleantech/energy/fuel tech startup; operational efficiency focus,Rolling,https://www.hindustanpetroleum.com/,HPCL
114,Bharat Petroleum Innovation Initiative,Energy/Tech,Early,5000000,50000000,Pan-India,"BPCL supporting startups developing petroleum technology, renewable energy, and energy security innovations.",Energy/pet-tech startup; infrastructure or operational innovation,Rolling,https://www.bharatpetroleum.com/,BPCL
115,State Bank of India Startup Loan Program,Multi-sector,Early/Growth,2000000,100000000,Pan-India,"SBI providing loans and credit facilities specifically designed for DPIIT-recognized startups at preferential rates.",DPIIT recognized startup; 6+ months operating history,Rolling,https://www.sbi.co.in/startups,SBI
116,EXIM Bank Trade Finance for Startups,Export/Tech,Early/Growth,5000000,100000000,Pan-India,"Export-Import Bank providing trade finance and export credit for startups looking to expand internationally.",Startup with export/import business model; ₹1+ crore revenue,Rolling,https://www.eximbankindia.in/,EXIM Bank
117,NABARD Agricultural Startup Scheme,Agritech,Seed,500000,10000000,Pan-India,"National Bank for Agriculture and Rural Development supporting agritech startups with microfinance and grants.",Agritech startup registered in rural area; agriculture innovation,Rolling,https://www.nabard.org/,NABARD
118,Atal Incubation Center Grants,Multi-sector,Seed,500000,5000000,Pan-India,"NITI Aayog-backed incubators providing non-dilutive grants and mentorship across 150+ centers nationwide.",Startup associated with AIM-recognized incubator,Rolling,https://aim.gov.in/aic,NITI Aayog
119,CFTC University Technology Park Support,Deeptech,Early,1000000,15000000,Pan-India,"Central government support for university technology parks incubating deeptech and research-commercialization startups.",University-affiliated startup; research-based innovation,Rolling,https://www.cftc.gov.in/,Ministry of Education
120,IIM Alumni Venture Fund,Multi-sector,Early/Growth,10000000,100000000,Pan-India,"IIM alumni-backed venture capital fund investing in business and tech startups with MBA founder backing.",MBA founder or IIM-affiliated team; business innovation focus,Rolling,https://iimbusinessventures.org/,IIM Alumni Network
121,XLRI Startup Fund,Multi-sector,Early,5000000,50000000,Pan-India,"Xavier School of Management alumni and institutional fund supporting management-backed tech and business startups.",XLRI alumni founder or institutional partnership,Rolling,https://www.xlri.ac.in/ventures,XLRI
122,ISB Mentorship and Venture Fund,Multi-sector,Growth,20000000,200000000,Pan-India,"Indian School of Business venture fund investing in high-growth startups with executive mentorship support.",Proven business traction; B2B/B2C scalable model; Series A+,Rolling,https://www.isb.edu/ventures,ISB
123,Ashoka University Startup Initiative,Multi-sector,Seed/Early,500000,10000000,Pan-India,"Ashoka University supporting student and alumni-led startups with incubation, mentorship, and seed funding.",Ashoka student/alumni founder; innovative business idea,Rolling,https://ashoka.edu.in/startup,Ashoka University
124,Delhi NCR Startup Fund,Multi-sector,Early/Growth,5000000,100000000,Delhi/NCR,"Regional government-backed fund for Delhi and NCR startups with focus on B2B tech and deep tech innovations.",DPIIT recognized startup; Delhi/NCR registered office,Rolling,https://delhi.startupindia.org/,Delhi Government
125,Bangalore Biotech Cluster Fund,Biotech/Pharma,Early,5000000,50000000,Karnataka,"Regional fund for biotech and pharmaceutical startups leveraging Bangalore's R&D infrastructure and talent pool.",Biotech/pharma startup; Bangalore-based R&D operations,Rolling,https://www.bangalorebiotech.org/,Karnataka Biotech Cluster
126,Hyderabad Tech Innovation Fund,Tech/Software,Early/Growth,5000000,100000000,Telangana,"City-specific fund for software, IT services, and technology startup in Hyderabad's thriving tech ecosystem.",Hyderabad-based tech startup; software/IT focus,Rolling,https://hyderabadtech.com/,Hyderabad IT Association
127,Pune Automobile & IoT Fund,Mobility/IoT,Early,5000000,50000000,Maharashtra,"Regional fund for automotive technology, IoT, and mobility solutions leveraging Pune's engineering talent.",Auto/IoT startup; Pune-based operations,Rolling,https://puneatech.org/,Pune Technology Council
128,Chennai Manufacturing Excellence Fund,Manufacturing/Tech,Early/Growth,5000000,100000000,Tamil Nadu,"Regional venture fund supporting manufacturing technology and industrial innovation in Chennai region.",Manufacturing/industrial startup; Chennai-based,Rolling,https://chennaitech.org/,Tamil Nadu Industries
129,Ahmedabad Fintech Fund,Fintech,Early/Growth,5000000,100000000,Gujarat,"Regional fund for financial technology startups benefiting from Ahmedabad's financial services ecosystem.",Fintech startup; Ahmedabad operations,Rolling,https://ahmedabadfintech.org/,Gujarat Financial Services
130,Mumbai FinTech Hub Fund,Fintech/Financial,Early/Growth,5000000,150000000,Maharashtra,"Financial services hub fund supporting fintech, insuretech, and capital market innovation startups in Mumbai.",Fintech/financial services startup; Mumbai-based; B2C/B2B model,Rolling,https://mumbaifintech.org/,Mumbai Financial Services